5,"sแบฃn phแบฉm giao hรng nhanh chรณng ฤรณng gรณi tแปt, khรดng cรณ thiแปt hแบกi. Sแบฃn phแบฉm ฤรบng nhฦฐ ฤฦกn ฤแบทt hรng, giรก rแบป, hoแบกt ฤแปng tแปt, mua tแบทng bร nแปi."
5,Cแบฃm ฦกn vรฌ ฤรฃ giao hรng nhanh chรณng Dแปch vแปฅ xuแบฅt sแบฏc tแปซ ngฦฐแปi bรกn ฤiแปn thoแบกi thรดng minh nhแบญn ฤฦฐแปฃc trong tรฌnh trแบกng tแปt.
5,"""Rแบฅt tแปt. Tรดi thรญch nรณ. Tรดi thรญch nรณ. Tรดi thรญch nรณ. Tรดi thรญch nรณ. Tรดi thรญch nรณ.""
Rแบฅt tแปt, tรดi thรญch nรณ rแบฅt nhiแปu.
Rแบป, rแบป, rแบป, ฤรกng giรก.
Giao hรng nhanh chรณng, ฤรณng gรณi tแปt.
Rแบฅt แบฅn tฦฐแปฃng."""
5,"Giao hรng nhanh chรณng, sแบฃn phแบฉm mแปi trong hแปp. Thรดng sแป kแปน thuแบญt trรชn vแป ฤiแปn thoแบกi, mรu sแบฏc ฤแบนp, ฤรกng ฤแปng tiแปn bรกt gแบกo, bแบกn hรฃy thแปญ tแบฃi game vร chฦกi."
5,"ฤแบนp, dแป sแปญ dแปฅng, giแปi thiแปu cแปญa hรng nรy. nแบฟu ai muแปn Tรดi sแบฝ ฤแบทt hรng lแบกi lแบงn sau."
5,"""Sแบฃn phแบฉm tแปt.
giรก trแป cแปงa ฤแปng tiแปn.
cลฉng rแบฅt dแป sแปญ dแปฅng

๐๐๐๐๐๐ """
5,"""Sแบฃn phแบฉm ฤแบนp, giao hรng nhanh, dแปch vแปฅ tแปt, rแบฅt ฤรกng mua, sแบฝ แปงng hแป tiแบฟp"
5,"Tรดi rแบฅt hรi lรฒng vแปi cรกc cuแปc gแปi mร tรดi nhแบญn ฤฦฐแปฃc. , Ngฦฐแปi bรกn rแบฅt hแปฏu รญch. Khi tรดi theo dรตi ฤฦกn ฤแบทt hรng cแปงa tรดi, hแป phแบฃn hแปi nhanh chรณng. ฤiแปu nรy cho phรฉp tรดi khรดng phแบฃi lo lแบฏng, hรฃy yรชn tรขm rแบฑng ฤฦกn hรng cแปงa tรดi ฤรฃ ฤฦฐแปฃc giao. Cรกm ฦกn rแบฅt nhiแปu! Nhรขn tiแปn, ฤiแปn thoแบกi nรy thแปฑc sแปฑ lร thฦฐฦกng hiแปu mแปi vร dแป sแปญ dแปฅng, giรก cแบฃ rแบฅt phแบฃi chฤng"
5,"""Nhแบญn hรng hรดm qua lแบญt ฤแบญt vรด mแป ra coi xau nhฦฐng ฤรบng vแปi shop ฤฤng trรชn trang . mแปซng vi mua ฤรบng sแบฃn phแบฉm mรฌnh cแบงn แบก ,chรบc shop mua mai bรกn ฤแบฏt, ร videos mang tรญnh chแบฅt nhรขn xu แบก
"""
5,"Hรi lรฒng vแปi tแปc ฤแป vร kแปน nฤng chฦกi game di ฤแปng. Thank you Cรกc mแบทt hรng vร quร tแบทng ฤฦฐแปฃc sแบฏp xแบฟp vร niรชm phong bแบฑng bแปc bong bรณng ""Sแบฃn phแบฉm tแปt, hแปฃp phรกp, ฤiแปn thoแบกi ฤฦฐแปฃc giแปi thiแปu hแปฃp phรกp 100%, rแบฅt thรญch, cแบฃm ฦกn dแปch vแปฅ cแปงa ngฦฐแปi bรกn"
5,"Tรดi ฤรฃ nhแบญn ฤฦฐแปฃc sแบฃn phแบฉm rแปi. Ngay sau khi tรดi nhแบญn ฤฦฐแปฃc nรณ, tรดi ฤรฃ thแปญ kiแปm tra. Hรฃy thแปญ nรณ, tแบฅt cแบฃ mแปi thแปฉ lร ok, khรดng cรณ sai sรณt, khรดng cรณ vแบฅn ฤแป, ฤรกng giรก. Nรณi chung lร coi tแปt ๐๐๐๐๐๐๐๐๐๐"
5,"Bao bรฌ lร ฤแบนp. Nรณ cลฉng chแบกy rแบฅt nhanh. Cรกi nรo thรบ vแป hฦกn cรกi ฤiแปn thoแบกi di ฤแปng cรณ chแบฅt lฦฐแปฃng hรฌnh แบฃnh rรต nรฉt vร giรก cแบฃ cao, mแบน tรดi rแบฅt thรญch, ฤiแปn thoแบกi di ฤแปng rแบฅt tแปt, sแปญ dแปฅng rแบฅt mฦฐแปฃt mร. Cแปญa hรng nรy cung cแบฅp rแบฅt nhiแปu phแบงn mแปm miแปn phรญ."
5,"Mua nรณ cho con trai tรดi, nรณ bแบฏt ฤแบงu chฦกi trรฒ chฦกi ngay khi cรณ nรณ, rแบฅt mฦฐแปฃt. Ngฦฐแปi bรกn rแบฅt nhแบน nhรng vร gแปญi rแบฅt nhiแปu thแปฉ"
5,"Nhแบญn ฤฦฐแปฃc, tแปt, rแบฅt hรi lรฒng, thแปi gian tแปi sแบฝ mua lแบกi, rแบฅt tแปt, giแปi thiแปu cแปญa hรng nรyyyyyyy"
5,ฤฦฐแปฃc dรnh cรณ ฤแปฉa em nรณ dรนng 
5,"Tรดi rแบฅt thรญch thiแบฟt bแป nรy, giรก tแปt vร hoแบกt ฤแปng nhanh. Tแบฅt cแบฃ bแบกn bรจ cแปงa tรดi hแปi tรดi nฦกi ฤแป mua vร tรดi sแบฝ sแปm mua mแปt cรกi khรกc."
5,"Nhแบญn ฤฦฐแปฃc sแบฃn phแบฉm trong tรฌnh trแบกng tแปt, ฤรณng gรณi tแปt, sแบฃn phแบฉm khรดng bแป hฦฐ hแปng, cรณ hแปp ฤแปฑng trong suแปt, ฤรฃ dรกn phim kรญnh."
5,"Sแบฃn phแบฉm tแปt vร dแป sแปญ dแปฅng, khรดng cรณ vแบฅn ฤแป gรฌ. Bแบกn cรณ thแป sแปญ dแปฅng แปฉng dแปฅng ngรขn hรng ฤแป tแบฃi xuแปng แปฉng dแปฅng vรญ. Giรก cแบฃ phแบฃi chฤng, chi phรญ rแบฅt hiแปu quแบฃ vร dแปch vแปฅ cแปงa ngฦฐแปi bรกn rแบฅt tแปt."
5,"Sแบฃn phแบฉm niรชm phong lร rแบฅt tแปt. Khรดng sao, khรดng sao cแบฃ, mรฌnh dรนng ฤฦฐแปฃc hฦกn 1 thรกng rแปiiiiiii."
5,Sแบฝ quay lแบกi แปงng hแป lแบงn nแปฏa
5,"Sแบฃn phแบฉm ฤฦฐแปฃc giao rแบฅt nhanh chรณng.
ฤรฃ ฤแบทt hรng hรดm qua nhแบญn ฤฦฐแปฃc hรดm nayโฆrแบฅt cแบฃm ฦกn ngฦฐแปi bรกn "
5,"Sแบฃn phแบฉm niรชm phong lร rแบฅt tแปt. Khรดng sao, khรดng sao cแบฃ, mรฌnh dรนng ฤฦฐแปฃc hฦกn 1 thรกng rแปi.
Shop giao nhanh lแบฏm."
5,"Toฬi raฬฬt vui viฬ ฤaฬ mua ฤuฬoฬฬฃc moฬฃฬt chieฬฬc ฤieฬฃฬn thoaฬฃi di ฤoฬฃฬng tuyeฬฃฬt voฬฬi nhuฬ vaฬฃฬy! ! Giao haฬng nhanh choฬng, noฬ nhanh choฬng, toฬi thiฬch noฬ! !"
1,oppo thรnh dt nhฦฐ cccc
1,"ฤแปซng mua ฤt shop nรy, bรกn hรng lแปซa ฤแบฃo,  yรชu cแบงu shop phแบฃn hแปi thรฌ chแป phแบฃn hแปi tแปฑ ฤแปng. Chแป dรขn chuyรชn vแป kแปน thuแบญt ฤiแปn thoแบกi mแปi biแบฟt shop lแปซa dแปi khรกch hรng.  Khรดng thแป chแบฅp nhแบญn ฤฦฐแปฃc kiแปu treo ฤแบงu dรช bรกn thแปt chรณ, mแปi ngฦฐแปi nรชn nรฉ cรกi shop nรy ra, sau khi chat vแปi khรกch thรฌ xรณa tin nhแบฏn, may mร tรดi ฤแปu chแปฅp lแบกi mรn Hรฌnh nรชn cรฒn bแบฑng chแปฉng"
