5,sp tốt giao nhanh shop đóng gói kỹ ảnh và video mang tính chất minh họa nhận xuuuuuuuuuuuuuuu
5,tuyệt vời hàng xài ok hình ảnh chỉ mang tính minh hoạ để nhận xu thôi nha chứ sản phẩm xài mượt ok lắm 
5,điện thoại dùng rất mượt và nhanh 
5,tuyệt vời hàng xài ok hình ảnh chỉ mang tính minh hoạ để nhận xu thôi nha chứ sản phẩm xài mượt ok lắm 
5,Chất lượng tuyệt vời giao hàng nhanh đóng gói tốt sẽ ủng hộ shop dài dài chuc shop mua may bán đắt
5,Chất lượng sản phẩm tuyệt vời giao hàng nhanh chúc shop mua mau bán đắt sẽ ủng hpoj shop lâu dài
5,"hàg đẹp chất lượng tốt sẽ quay lại ủng hộ shop tiếp
mọi người nên mua nha máy mượt sài okila .,!"
5,"Sản phẩm tốt, dùng rất thích. Cấu hình ngon, mượt
..................................."
5,"Điện thoại dùng tốt , mượt , chất lượng , giá cả hợp lí , thiết kế đẹp mắt , hiện đại nói chung rất tuyệt nha "
5,"hàg đẹp chất lượng tốt sẽ quay lại ủng hộ shop tiếp
mọi người nên mua nha máy mượt sài okila .,!"
5,Ok . Nên mua nhé mọi người. Giao hàng nhanh .ship nhiệt tình. Lần sau sẽ ủng hộ shop thêm . Bnhh
5,"Chất lượng sản phẩm tuyệt vời !
Đóng gói sản phẩm kĩ càng !"
5,có saltwater ko ạ có saltwater ko ạ có saltwater ko ạ có saltwater ko ạ có saltwater ko ạ có saltwater ko ạ
5,"Máy sử dụng ok, chất lượng tuyệt vời. Thao tác nhanh nhạu, shop giao hàng nhanh. Bọc hàng kĩ lưỡng"
5,"Máy sử dụng nhanh nhạy, shop chính hãng. Sử dụng một thời gian mong sẽ không có hiện tượng giật, lag. Chất lượng!"
5,có saltwater ko ạ có saltwater ko ạ có saltwater ko ạ có saltwater ko ạ có saltwater ko ạ có saltwater ko ạ có saltwater ko ạ có saltwater ko ạ
5,okkkkkkkkkkkkkkkkkkkkkkkkkkkkkkkkkkkkkkkkkkkkkkkkkkkkkkkkkkkkkkkkkkkkkkkkkkkkk 
5,"làm sao để bật nhân bản ứng dựng trên điện thoại realme narzo 50i prime , shop hướng dẫn với ạ"
5,tốt xuất sắc 
5,chưa sử dụng nên chưa nhận xét được đợi một thời gian khui hàng sẽ đánh giá sau
5,Hàng đóng gói chắc chắn. Màu đúng theo yêu cầu. Rẻ đẹp 
5,máy đẹp xài mượt mà 
5,xuất sắc 
5,Điện thoại này mình thích lâu rồi nên hôm qua shop giảm giá nên mình  mua một cái màu xanh biển lun hihi. Kc ảnh dt do lười chụp . Nma chất lg siu siu ok nha
5,Điện thoại 9 hãng rất tốt
5,Chất lượng sản phẩm tuyệt vời
5,Hàng chất lượng lắm nhá
5,Shop chuẩn bị hàng siêu nhanh. Đt dùng thích lắm ạ. Pin trâu. Chụp ảnh nét ạ. Sẽ quay lại khi chó nhu cầu ạ
5,"shop giao hàng nhanh,đpngs gói cẩn thận,sản phẩm tốt"
5,Nhận được điện thoại mà vui ghê ấy muốn cùng lúc shop giảm giá nên giá rất hời sẽ ủng hộ shop lần sau ạ
5,Tốt cho 5 sao
5,"m nhận đc điện thoại ui. đóng gói rất cẩn thận, giao hàng nhanh, không bị va đập, vỡ hay xước màn hình, giá lại rẻ nữa"
5,sản phẩm rất tốt đẹp đóng gói hàng rất kĩ 
5,"sp đúng như mô tả, shop giao đủ hàng.
"
5,"giao hàng nhanh đóng gói cẩn thận sp tốt
"
5,"Hàng đẹp, khỏe ,chất lượng tốt "
5,"giao hàng nhanh , đóng gói tốt shop tư vấn nhiệt tình "
5,Shop bọc hàng rất cẩn thận giao hàng siêu nhanh máy chạy mướt vào mạng nhanh sẽ. Quay lại ủg hộ shop tiếp
5,"Máy giống như hình của shop, màn hình sáng, nhạy mượt, đóng gói cẩn thận, ns chung là hàng ổn đấy ạ"
5,tuyệt vời iiiiiiiiiiiiiiiiiiiiiiiiiiiiiiiiiiiiiiiiiiiiiiiiiiiiiiiiiiiiiiiiiii
5,Máy ok ổn
5,hàng đẹp 
5,xuất sac
5,"Giao hàng nhanh, anh ship siêu vui tính. Đt đẹp lắm an. Chụp ảnh nét luôn"
5,Điện thoại hữu ích rẻ và đẹp shop đóng gói kĩ càng giá cả hợp lí cho học sinh sinh viên ship giao nhanh.
5,hbbsksbnkknbnzjxkbdnkslnbbnxknxnxknxnxjjnnxndnxjxbxnxjxnnxjxxknxnxjxjxnxbxjdbx
5,"sp đúng như mô tả, shop giao đủ hàng.Sẽ ủng hộ tiếp"
5,"sp đúng như mô tả, shop giao đủ hàng.Sẽ ùng hộ tiếp
"
5,chất lượng tuyệt vời 
5,"máy đẹp xuất sắc giai hàng nhanh ko chậm đóng gói kĩ càng. Đúng như trong ảnh, cảm cũng ổn, chụp cũng sươn sương"
